{
  "templates": 20,
  "targets": 100,
  "acc_none": 0.74,
  "acc_same": 0.51,
  "acc_other": 0.54,
  "effort_none": 396.44,
  "effort_same": 299.32,
  "effort_other": 353.7,
  "d_acc_same": -0.22999999999999998,
  "d_acc_other": -0.19999999999999996,
  "d_effort_same": -0.24498032489153468,
  "d_effort_other": -0.10780950459085867,
  "ci95": {
    "d_acc_same": [
      -0.41,
      -0.07999999999999996
    ],
    "d_acc_other": [
      -0.36025,
      -0.050000000000000044
    ],
    "d_effort_same": [
      -0.5272059516044417,
      0.11520912648710346
    ],
    "d_effort_other": [
      -0.41855540522366935,
      0.34523135826278173
    ]
  },
  "mock_equivalents": {
    "math_skill": 0.71063232421875,
    "hint_gain": -0.53643798828125,
    "hint_gain_ci95": [
      -0.70123291015625,
      -0.19769287109375
    ],
    "procedural_transfer": 1.05670166015625
  },
  "verdict": "kill"
}